{
  "$schema": "https://json-schema.org/draft/2020-12/schema",
  "$id": "https://coderit.it/piattaforma-corsi/curriculum.schema.json",
  "title": "Curriculum (CURRICULUM SSOT store)",
  "description": "Schema for the CURRICULUM SSOT store (design/curriculum.json), written by learning-curriculum-sequencer. Sequences the DESIGN graph's taught nodes (Baseline excluded) into sessions of ordered lessons, embedded checkpoints, and assessments, each carrying a delivery style so downstream tools can pick a material-generation strategy per item. Node ids referenced by `node_ref` must exist in design/knowledge_goals_graph.json.",
  "type": "object",
  "additionalProperties": false,
  "required": ["course_name", "source_design_graph", "sessions", "coverage"],
  "properties": {
    "course_name": {
      "type": "string",
      "description": "Must match the course_name in design/knowledge_goals_graph.json."
    },
    "source_design_graph": {
      "type": "object",
      "description": "Provenance of the DESIGN graph this curriculum was sequenced from.",
      "additionalProperties": false,
      "required": ["path", "checked"],
      "properties": {
        "path": {
          "type": "string",
          "description": "Path to the DESIGN store, e.g. design/knowledge_goals_graph.json."
        },
        "checked": {
          "type": "boolean",
          "description": "Whether `tools/graph/graph check` was run against the graph before/as part of sequencing this curriculum. False means the graph's schema and closure are unverified."
        }
      }
    },
    "sequencing_rules": {
      "type": "array",
      "description": "Ordered priority rules used to produce the sequence (free text, for human audit).",
      "items": { "type": "string" }
    },
    "design_decisions": {
      "type": "array",
      "description": "Deliberate deviations, risks, or open items flagged for human review, e.g. a root Prerequisite blocked on an external deliverable, or a non-quickest-path ordering chosen for framing.",
      "items": { "$ref": "#/$defs/design_decision" }
    },
    "sessions": {
      "type": "array",
      "description": "Ordered delivery sessions. Order in this array is the delivery order.",
      "items": { "$ref": "#/$defs/session" },
      "minItems": 1
    },
    "coverage": { "$ref": "#/$defs/coverage" }
  },
  "$defs": {
    "persona_ref": {
      "type": "string",
      "description": "A persona id from STUDENT_PERSONAS/DESIGN for this course (e.g. P-DEV, P-DBA, P-PM — any persona set the course defines), or \"shared\" when a task is not lane-specific.",
      "pattern": "^(P-[A-Z0-9]+|shared)$"
    },

    "delivery_style": {
      "type": "string",
      "description": "The pedagogical shape of the item. Drives which material-generation strategy a downstream tool applies (e.g. lecture -> slide deck, hands_on_practical -> exercise sheet + starter repo, briefing -> handout only).",
      "enum": [
        "lecture",
        "lecture_discussion",
        "lecture_demo",
        "group_discussion",
        "hands_on_practical",
        "briefing",
        "project_based"
      ]
    },

    "delivery_pattern": {
      "type": "string",
      "description": "How the item is split across personas, independent of which/how many personas the course defines. \"shared\": everyone does the same thing together. \"multi_lane\": two or more personas work concurrently on distinct tasks (see lane_tasks for who does what). \"single_lane\": only one persona is active while the rest observe or skip. \"persona_led\": one persona leads/explains to the rest (use lane_tasks' role to name who leads). Which persona(s) are involved is never encoded in this value — always look at lane_tasks.",
      "enum": [
        "shared",
        "multi_lane",
        "single_lane",
        "persona_led"
      ]
    },

    "support_material_kind": {
      "type": "string",
      "description": "Category of a support material entry, so tooling can route it to the right generator or simply link an existing asset.",
      "enum": [
        "reading",
        "video",
        "reference_doc",
        "diagram",
        "cheat_sheet",
        "config_template",
        "exercise_sheet",
        "test_script",
        "rubric",
        "worked_example",
        "other"
      ]
    },

    "support_material": {
      "type": "object",
      "additionalProperties": false,
      "required": ["kind", "description"],
      "properties": {
        "kind": { "$ref": "#/$defs/support_material_kind" },
        "description": { "type": "string" },
        "uri": {
          "type": "string",
          "description": "Optional link/path to the actual asset, once it exists under material/."
        }
      }
    },

    "lane_task": {
      "type": "object",
      "description": "One persona's concrete task within an item that has a two_lane (or single-lane) delivery_pattern.",
      "additionalProperties": false,
      "required": ["persona", "task"],
      "properties": {
        "persona": { "$ref": "#/$defs/persona_ref" },
        "task": { "type": "string" },
        "role": {
          "type": "string",
          "description": "This persona's part in the item's delivery_pattern. Use \"lead\" for the persona named by a persona_led item; \"skip\" for a persona sitting the item out (skippable_by in DESIGN).",
          "enum": ["lead", "contributor", "observer", "skip"]
        }
      }
    },

    "item_type": {
      "type": "string",
      "enum": ["lesson", "checkpoint", "assessment"]
    },

    "assessment_kind": {
      "type": "string",
      "description": "Only meaningful when item_type is \"assessment\".",
      "enum": ["practical_pass_fail", "capstone"]
    },

    "item": {
      "type": "object",
      "description": "One row of the sequence table: a taught node, an embedded DR checkpoint, or an assessment.",
      "additionalProperties": false,
      "required": ["sequence", "item_type", "title", "delivery_pattern", "duration_minutes"],
      "properties": {
        "sequence": {
          "type": "string",
          "description": "Display order key as used in the source doc (e.g. \"1\", \"A1\", \"13\"). Array position is authoritative for ordering; this is for cross-referencing the human-readable doc."
        },
        "node_ref": {
          "type": "string",
          "description": "Id of the DESIGN node this item teaches or checks (e.g. PRQ-SCG-BASICS, DR-DEPLOY-GATEWAY). Required for item_type lesson and checkpoint; omitted for a pure cross-DR assessment such as the final capstone.",
          "pattern": "^(BSL|PRQ|DR)-[A-Z0-9-]+$"
        },
        "item_type": { "$ref": "#/$defs/item_type" },
        "title": {
          "type": "string",
          "description": "Human-readable topic/label for this item."
        },
        "style": {
          "$ref": "#/$defs/delivery_style",
          "description": "Required for item_type lesson; a checkpoint or assessment may omit it (see assessment_kind instead) or reuse the enclosing lesson's style."
        },
        "delivery_pattern": { "$ref": "#/$defs/delivery_pattern" },
        "duration_minutes": {
          "type": ["number", "null"],
          "description": "Minutes budgeted for this item. Null for a checkpoint embedded inside another item's time (see embedded_in)."
        },
        "embedded_in": {
          "type": "string",
          "description": "Sequence key of the item whose duration already includes this checkpoint's time (e.g. a DR checkpoint reached in the last minutes of the preceding lesson). Required when duration_minutes is null."
        },
        "lane_tasks": {
          "type": "array",
          "description": "Per-persona breakdown when delivery_pattern splits work by lane. Omit for fully shared items.",
          "items": { "$ref": "#/$defs/lane_task" }
        },
        "assessment_kind": { "$ref": "#/$defs/assessment_kind" },
        "rubric": {
          "type": "string",
          "description": "Pass/fail criteria. Expected on item_type assessment."
        },
        "covers_node_refs": {
          "type": "array",
          "description": "For a capstone/final assessment that checks multiple DRs at once, the full list of DR ids it covers.",
          "items": {
            "type": "string",
            "pattern": "^DR-[A-Z0-9-]+$"
          }
        },
        "support_material": {
          "type": "array",
          "items": { "$ref": "#/$defs/support_material" }
        },
        "notes": {
          "type": "string",
          "description": "Free-text asides (e.g. why this item's rubric/timing looks the way it does)."
        }
      },
      "allOf": [
        {
          "if": { "properties": { "item_type": { "const": "lesson" } } },
          "then": { "required": ["node_ref", "style"] }
        },
        {
          "if": { "properties": { "item_type": { "const": "checkpoint" } } },
          "then": { "required": ["node_ref"] }
        },
        {
          "if": { "properties": { "item_type": { "const": "assessment" } } },
          "then": { "required": ["assessment_kind", "rubric"] }
        },
        {
          "if": {
            "properties": { "duration_minutes": { "const": null } }
          },
          "then": { "required": ["embedded_in"] }
        }
      ]
    },

    "homework_item": {
      "type": "object",
      "additionalProperties": false,
      "required": ["description"],
      "properties": {
        "description": { "type": "string" },
        "node_ref": {
          "type": "string",
          "description": "DESIGN node this homework advances, if any.",
          "pattern": "^(BSL|PRQ|DR)-[A-Z0-9-]+$"
        },
        "owner": {
          "type": "string",
          "description": "Who is responsible (a persona ref, or an external party such as the client)."
        },
        "due": {
          "type": "string",
          "description": "Deadline, e.g. \"before Session 2\"."
        }
      }
    },

    "session": {
      "type": "object",
      "additionalProperties": false,
      "required": ["session_number", "title", "usable_minutes", "items"],
      "properties": {
        "session_number": { "type": "integer", "minimum": 1 },
        "title": { "type": "string" },
        "target_minutes": {
          "type": "number",
          "description": "The target teaching/assessment minutes for this session (may be below usable_minutes to leave buffer)."
        },
        "usable_minutes": {
          "type": "number",
          "description": "Usable minutes in the session block after accounting for setup/breaks/friction, per LOGISTICS."
        },
        "total_minutes": {
          "type": "number",
          "description": "Sum of this session's items' duration_minutes (null durations contribute 0). Provided for cross-check against a tool's own recomputation."
        },
        "items": {
          "type": "array",
          "items": { "$ref": "#/$defs/item" },
          "minItems": 1
        },
        "homework": {
          "type": "array",
          "description": "Work assigned for the inter-session gap after this session.",
          "items": { "$ref": "#/$defs/homework_item" }
        }
      }
    },

    "design_decision": {
      "type": "object",
      "additionalProperties": false,
      "required": ["category", "summary"],
      "properties": {
        "category": {
          "type": "string",
          "enum": ["risk", "deviation", "deferred_decision", "homework_dependency"]
        },
        "summary": { "type": "string" },
        "node_refs": {
          "type": "array",
          "items": {
            "type": "string",
            "pattern": "^(BSL|PRQ|DR)-[A-Z0-9-]+$"
          }
        },
        "owner": { "type": "string" },
        "due": { "type": "string" }
      }
    },

    "coverage": {
      "type": "object",
      "description": "Cross-check that every taught node in DESIGN appears exactly once in sessions, computed at write time (a tool consuming this file should still recompute rather than trust it blindly).",
      "additionalProperties": false,
      "required": ["taught_node_refs", "untaught_baseline_node_refs"],
      "properties": {
        "taught_node_refs": {
          "type": "array",
          "items": { "type": "string" },
          "uniqueItems": true
        },
        "untaught_baseline_node_refs": {
          "type": "array",
          "description": "Baseline nodes intentionally not taught (already held per DESIGN held_by).",
          "items": { "type": "string" },
          "uniqueItems": true
        }
      }
    }
  }
}
