{
  "course_name": "Spring Cloud Gateway for a Strangler-Fig Migration to GKE",
  "source_design_graph": {
    "path": "design/knowledge_goals_graph.json",
    "checked": false
  },
  "sequencing_rules": [
    "Respect every Requires edge in DESIGN (a node is only taught once all nodes it points to are already taught).",
    "Prefer the order that reaches each DesiredResult fastest from the Baseline nodes, subject to that constraint.",
    "Group topologically-tied nodes into a coherent narrative arc per session rather than strictly interleaving by minimal graph depth, when a session boundary or the 1-week gap between sessions makes that clearer for a mixed Dev/Ops room.",
    "Keep every hands-on block offering a meaningful role to both personas (multi_lane) unless the underlying DESIGN node's audience/skippable_by/persona_variant restricts it to one persona."
  ],
  "design_decisions": [
    {
      "category": "risk",
      "summary": "PRQ-LEGACY-TOKEN-FORMAT is a root node tagged [risk] in DESIGN: the legacy application's exact expected token shape is not in the specs and must be supplied by the client. It is scheduled briefly near the start of the token-minting block in Session 2; if the client has not supplied it by then, PRQ-TOKEN-MINTING-LOGIC, PRQ-TOKEN-PROPAGATION and DR-MINT-TOKEN cannot proceed as scheduled and this whole tail of Session 2 would need to fall back to a worked example instead of the team's real format.",
      "node_refs": ["PRQ-LEGACY-TOKEN-FORMAT", "PRQ-TOKEN-MINTING-LOGIC", "PRQ-TOKEN-PROPAGATION", "DR-MINT-TOKEN"],
      "owner": "client",
      "due": "before Session 2"
    },
    {
      "category": "risk",
      "summary": "The dev-only token-minting block at the end of Session 2 (custom filter authoring through DR-MINT-TOKEN, ~70 minutes) leaves both Ops participants in an observer role for a sustained stretch, which runs against the cross-persona design directive that every hands-on block give Ops a meaningful task. This is accepted because DR-MINT-TOKEN's audience is P-DEV only per DESIGN, but the trainer should actively use Ops's observer time (e.g. having them shadow-verify the resulting downstream request, or prep the capstone's operational checklist) rather than letting them disengage.",
      "node_refs": ["PRQ-CUSTOM-GLOBALFILTER-AUTHORING", "PRQ-LEGACY-TOKEN-FORMAT", "PRQ-JWT-FUNDAMENTALS-DEEP", "PRQ-TOKEN-MINTING-LOGIC", "PRQ-TOKEN-PROPAGATION", "DR-MINT-TOKEN"],
      "owner": "instructor"
    },
    {
      "category": "deferred_decision",
      "summary": "LOGISTICS states 2 sessions x 4h but does not itemize a setup/break buffer. This curriculum assumes 225 usable minutes per 240-minute session (a 15-minute buffer per session for Teams/remote friction, breaks, and questions) and budgets items against that figure. Confirm with the human whether 225 is the right usable-minutes figure before sign-off.",
      "owner": "human reviewer"
    },
    {
      "category": "deviation",
      "summary": "Strict quickest-path-per-node-depth would let DR-DEPLOY-GATEWAY, DR-VALIDATE-AUTH and DR-TRACING interleave more tightly since they sit at similar graph depth. Instead, DR-DEPLOY-GATEWAY and DR-STRANGLER-ROUTING (the two objectives already reachable once route config exists) are grouped into Session 1 as a 'get something running and split traffic' arc, and DR-VALIDATE-AUTH, DR-TRACING and DR-MINT-TOKEN are grouped into Session 2 as a 'secure, observe, extend' arc. This still respects every Requires edge; it optimizes for narrative coherence across the 1-week gap between sessions over strict depth-interleaving.",
      "node_refs": ["DR-DEPLOY-GATEWAY", "DR-STRANGLER-ROUTING", "DR-VALIDATE-AUTH", "DR-TRACING", "DR-MINT-TOKEN"]
    },
    {
      "category": "deviation",
      "summary": "PRQ-K8S-DEPLOY-CONCEPTS is marked skippable_by P-OPS in DESIGN (Ops already hold this via BSL-GKE-CONTAINERS). It is kept as a short single_lane refresher for developers only rather than dropped entirely, since P-DEV's baseline does not include GKE comfort and PRQ-GKE-DEPLOY-GATEWAY depends on it.",
      "node_refs": ["PRQ-K8S-DEPLOY-CONCEPTS"]
    }
  ],
  "sessions": [
    {
      "session_number": 1,
      "title": "Deploying the Gateway and Splitting Traffic (Strangler Routing)",
      "target_minutes": 215,
      "usable_minutes": 225,
      "total_minutes": 215,
      "items": [
        {
          "sequence": "1",
          "node_ref": "PRQ-STRANGLER-FIG-PATTERN",
          "item_type": "lesson",
          "title": "The strangler-fig migration pattern",
          "style": "lecture_discussion",
          "delivery_pattern": "shared",
          "duration_minutes": 15,
          "support_material": [
            { "kind": "reading", "description": "Short reference article/summary on the strangler-fig pattern for legacy migrations." },
            { "kind": "diagram", "description": "Diagram of legacy + gateway + migrated microservices coexisting during the migration window." }
          ],
          "notes": "Root node in DESIGN (no prerequisite); opens the course as the motivating framing for every DR that follows."
        },
        {
          "sequence": "2",
          "node_ref": "PRQ-SCG-BASICS",
          "item_type": "lesson",
          "title": "What Spring Cloud Gateway is: an edge reverse-proxy in front of legacy and new services",
          "style": "lecture",
          "delivery_pattern": "shared",
          "duration_minutes": 15,
          "support_material": [
            { "kind": "diagram", "description": "Request-flow diagram: client -> Spring Cloud Gateway -> {legacy system, migrated microservices}." }
          ]
        },
        {
          "sequence": "3",
          "node_ref": "PRQ-K8S-DEPLOY-CONCEPTS",
          "item_type": "lesson",
          "title": "Kubernetes deployment concepts on GKE (Deployments, Services, Ingress) — refresher for developers",
          "style": "lecture",
          "delivery_pattern": "single_lane",
          "duration_minutes": 10,
          "lane_tasks": [
            { "persona": "P-DEV", "task": "Refresh Deployment/Service/Ingress concepts as applied on GKE.", "role": "contributor" },
            { "persona": "P-OPS", "task": "Already fluent via prior GKE experience; sits this one out.", "role": "skip" }
          ],
          "notes": "skippable_by P-OPS per DESIGN (covered by BSL-GKE-CONTAINERS)."
        },
        {
          "sequence": "4",
          "node_ref": "PRQ-CONTAINERIZE-GATEWAY",
          "item_type": "lesson",
          "title": "Building a container image for the gateway",
          "style": "hands_on_practical",
          "delivery_pattern": "multi_lane",
          "duration_minutes": 30,
          "lane_tasks": [
            { "persona": "P-DEV", "task": "Author/maintain the Dockerfile and application build for the gateway image.", "role": "contributor" },
            { "persona": "P-OPS", "task": "Operate the image build/publish pipeline and container registry.", "role": "contributor" }
          ],
          "support_material": [
            { "kind": "config_template", "description": "Sample Dockerfile for a Spring Boot / Spring Cloud Gateway image." },
            { "kind": "exercise_sheet", "description": "Step-by-step: build, tag, and push the gateway image to the team's registry." }
          ]
        },
        {
          "sequence": "5",
          "node_ref": "PRQ-GKE-DEPLOY-GATEWAY",
          "item_type": "lesson",
          "title": "Deploying the containerized gateway to the GKE cluster",
          "style": "hands_on_practical",
          "delivery_pattern": "multi_lane",
          "duration_minutes": 40,
          "lane_tasks": [
            { "persona": "P-OPS", "task": "Lead manifest authoring and the cluster deployment itself.", "role": "lead" },
            { "persona": "P-DEV", "task": "Follow the deployment closely enough to debug and iterate on the running gateway later.", "role": "observer" }
          ],
          "support_material": [
            { "kind": "config_template", "description": "Sample Deployment/Service/Ingress manifests for the gateway on GKE." },
            { "kind": "reference_doc", "description": "Checklist for confirming a GKE-deployed service is reachable." }
          ]
        },
        {
          "sequence": "6",
          "node_ref": "DR-DEPLOY-GATEWAY",
          "item_type": "checkpoint",
          "title": "Checkpoint: gateway reachable on GKE",
          "delivery_pattern": "multi_lane",
          "duration_minutes": 15,
          "rubric": "Pass if: the gateway pod is Running/Ready in GKE, a Service/Ingress exposes it, and a test HTTP request from outside the cluster reaches the gateway and gets a response (even a default 404 from an unrouted path counts, provided it is the gateway responding, not a network timeout).",
          "lane_tasks": [
            { "persona": "P-OPS", "task": "Confirm the gateway pod is healthy and reachable from the exposing Service/Ingress.", "role": "contributor" },
            { "persona": "P-DEV", "task": "Hit the gateway from a client and confirm it responds.", "role": "contributor" }
          ],
          "support_material": [
            { "kind": "rubric", "description": "Pass/fail checklist for gateway reachability, shared with participants before the check." }
          ]
        },
        {
          "sequence": "7",
          "node_ref": "PRQ-GATEWAY-ROUTE-CONFIG",
          "item_type": "lesson",
          "title": "The route model: predicates and filters, declared via Java DSL or YAML",
          "style": "lecture_demo",
          "delivery_pattern": "shared",
          "duration_minutes": 15,
          "support_material": [
            { "kind": "cheat_sheet", "description": "One-page reference of common built-in predicates and filters." }
          ]
        },
        {
          "sequence": "8",
          "node_ref": "PRQ-PATH-BASED-ROUTING",
          "item_type": "lesson",